{
  "$schema": "https://json-schema.org/draft/2020-12/schema",
  "$id": "https://github.com/jojkaart/Endfield-battle-simulator/schemas/scenario.schema.json",
  "title": "Scenario",
  "description": "A team, a target and a rotation to simulate on the timeline (packages/engine/src/timeline.ts).",
  "type": "object",
  "required": ["team", "target", "durationSeconds", "rotation"],
  "additionalProperties": false,
  "properties": {
    "$schema": { "type": "string" },
    "description": { "type": "string" },
    "team": {
      "type": "array",
      "minItems": 1,
      "maxItems": 4,
      "items": { "oneOf": [{ "type": "string", "description": "Path of a build file, relative to the scenario file." }, { "$ref": "build.schema.json" }] }
    },
    "controlled": { "type": "string", "description": "Operator controlled at the start (default: the first)." },
    "startEnergy": {
      "type": "object",
      "description": "Ultimate energy at the start, per operator ID: a number or \"full\" (default 0).",
      "additionalProperties": { "oneOf": [{ "type": "number", "minimum": 0 }, { "const": "full" }] }
    },
    "startStacks": {
      "type": "object",
      "description": "Kit stacks at the start, per operator ID and stack ID (default: the kit's initial value, else 0).",
      "additionalProperties": { "type": "object", "additionalProperties": { "type": "number", "minimum": 0 } }
    },
    "target": {
      "type": "object",
      "required": ["enemy", "level"],
      "additionalProperties": false,
      "properties": {
        "enemy": { "type": "string" },
        "level": { "type": "integer", "minimum": 1 },
        "controlImmune": { "type": "boolean", "description": "Control statuses don't freeze this enemy (bosses with the control-immune tag; the data has no list)." }
      }
    },
    "durationSeconds": { "type": "number", "exclusiveMinimum": 0 },
    "crit": { "enum": ["never", "always", "expected", "rolled"], "description": "expected: the crit zone at its average; rolled: each hit crits or not by a seeded roll (crit-triggered effects need it)." },
    "seed": { "type": "integer", "minimum": 0, "maximum": 4294967295, "description": "Seed of the battle's random draws (rolled crits); default 1." },
    "enemyHp": {
      "type": "array",
      "description": "The enemy's HP over the fight: from each time (seconds), its fraction of Max HP; full before the first. For effects that need the enemy below an HP threshold.",
      "items": {
        "type": "object",
        "required": ["at", "fraction"],
        "additionalProperties": false,
        "properties": {
          "at": { "type": "number", "minimum": 0 },
          "fraction": { "type": "number", "minimum": 0, "maximum": 1 }
        }
      }
    },
    "dodge": {
      "type": "object",
      "required": ["chance"],
      "additionalProperties": false,
      "properties": {
        "chance": { "type": "number", "minimum": 0, "maximum": 1, "description": "Chance that a dash is a perfect dodge (1: a skilled player; less for a less skilled one; 0: dashes that never succeed)." }
      },
      "description": "The controlled operator dashes at every enemy attack on it (enemyActions); a perfect dodge ends its action, gives SP and slows the world, cooldowns excepted. Absent: no dodges."
    },
    "enemyActions": {
      "type": "array",
      "description": "What the enemy does (default nothing): attacks on the team and skill charges, at listed times or every n seconds. Times are on the enemy's clock: time stops and freezes delay what comes after them.",
      "items": {
        "type": "object",
        "required": ["kind"],
        "additionalProperties": false,
        "properties": {
          "kind": { "enum": ["attack", "charge"] },
          "at": { "type": "array", "items": { "type": "number", "minimum": 0 }, "description": "Times in seconds." },
          "every": { "type": "number", "exclusiveMinimum": 0, "description": "Or every n seconds, from `from` (default n) to the fight's end." },
          "from": { "type": "number", "minimum": 0 },
          "target": { "type": "string", "description": "Whom an attack hits: controlled (default), team, or an operator ID." },
          "element": { "enum": ["physical", "fire", "pulse", "cryst", "natural", "ether"], "description": "An attack's damage element (default physical)." }
        }
      }
    },
    "rotation": {
      "type": "array",
      "items": {
        "type": "object",
        "required": ["operator", "skill"],
        "additionalProperties": false,
        "properties": {
          "operator": { "type": "string" },
          "skill": { "type": "string", "description": "Kit skill ID, or \"swap\"." },
          "at": { "type": "number", "minimum": 0, "description": "Earliest start, in seconds." },
          "repeat": { "type": "integer", "minimum": 1, "description": "Repeat this action n times." }
        }
      }
    }
  }
}
