{
  "$schema": "../schemas/scenario.schema.json",
  "description": "A full team of the owner's favourites at the owner's default potentials (6-stars P0): Si (Team Position 01, the controlled operator; the build of si-jade-vessel.json at P0), Laevatain (laevatain-forgeborn.json at P0), Liino (liino-heal-usp.json) and Gilberta (gilberta-usp02.json) vs Rhodagn, every ultimate charged, 20 s. The rotation is the one efsim search found without swaps (the owner doesn't swap; 2026-10-25, --beam 12: beams 6 / 12 / 24 gave 2,434,451 / 2,650,070 / 2,691,389, the best kept), so it's a search result, not a hand-written plan: Si does every basic attack and dive, the others cast their skills. With swaps the search found 3,464,381 (in-game tests 15 and 97 decide how real that is).",
  "team": [
    {
      "operator": "chr_0036_jsspsi",
      "level": 90,
      "promotion": 4,
      "potential": 0,
      "skillLevels": {
        "basic": 12,
        "battle": 12,
        "combo": 12,
        "ultimate": 12
      },
      "weapon": {
        "id": "wpn_claym_0018",
        "level": 90,
        "skillLevels": [
          9,
          9,
          8
        ]
      },
      "gear": [
        {
          "id": "item_equip_t4_suit_atk02_hand_03",
          "artifice": [
            3,
            3,
            3
          ]
        },
        {
          "id": "item_equip_t4_suit_atk02_body_05",
          "artifice": [
            3,
            3,
            3
          ]
        },
        {
          "id": "item_equip_t4_suit_atk02_edc_06",
          "artifice": [
            3,
            3,
            3
          ]
        },
        {
          "id": "item_equip_t4_suit_heal01_edc_03",
          "artifice": [
            0,
            3,
            3
          ]
        }
      ]
    },
    {
      "operator": "chr_0016_laevat",
      "level": 90,
      "promotion": 4,
      "potential": 0,
      "talents": [
        3,
        2
      ],
      "skillLevels": {
        "basic": 12,
        "battle": 12,
        "combo": 12,
        "ultimate": 12
      },
      "weapon": {
        "id": "wpn_sword_0006",
        "level": 90,
        "skillLevels": [
          9,
          9,
          9
        ]
      },
      "gear": [
        {
          "id": "item_equip_t4_suit_burst01_body_01",
          "artifice": [
            3,
            3,
            3
          ]
        },
        {
          "id": "item_equip_t4_suit_fire_natr01_hand_02",
          "artifice": [
            3,
            3,
            3
          ]
        },
        {
          "id": "item_equip_t4_parts_wuling01_edc_03",
          "artifice": [
            3,
            3,
            3
          ]
        },
        {
          "id": "item_equip_t4_parts_wuling01_edc_03",
          "artifice": [
            3,
            3,
            3
          ]
        }
      ]
    },
    "liino-heal-usp.json",
    "gilberta-usp02.json"
  ],
  "target": {
    "enemy": "eny_0051_rodin",
    "level": 90
  },
  "startEnergy": {
    "chr_0036_jsspsi": "full",
    "chr_0016_laevat": "full",
    "chr_0035_liino": "full",
    "chr_0013_aglina": "full"
  },
  "durationSeconds": 20,
  "crit": "expected",
  "rotation": [
    { "operator": "chr_0035_liino", "skill": "chr_0035_liino_ultimate_skill", "at": 0 },
    { "operator": "chr_0013_aglina", "skill": "chr_0013_aglina_ultimate_skill", "at": 0 },
    { "operator": "chr_0036_jsspsi", "skill": "chr_0036_jsspsi_normal_skill", "at": 0 },
    { "operator": "chr_0036_jsspsi", "skill": "chr_0036_jsspsi_ultimate_skill", "at": 0 },
    { "operator": "chr_0016_laevat", "skill": "chr_0016_laevat_ultimate_skill", "at": 0 },
    { "operator": "chr_0036_jsspsi", "skill": "chr_0036_jsspsi_combo_skill", "at": 2.1333333333333333 },
    { "operator": "chr_0013_aglina", "skill": "chr_0013_aglina_combo_skill", "at": 2.2333333333333334 },
    { "operator": "chr_0016_laevat", "skill": "chr_0016_laevat_ult_attack1", "at": 2.533333333333333 },
    { "operator": "chr_0036_jsspsi", "skill": "chr_0036_jsspsi_normal_skill_1", "at": 2.8666666666666667 },
    { "operator": "chr_0016_laevat", "skill": "chr_0016_laevat_ult_attack2", "at": 3.1 },
    { "operator": "chr_0036_jsspsi", "skill": "chr_0036_jsspsi_normal_skill_2", "at": 3.6 },
    { "operator": "chr_0016_laevat", "skill": "chr_0016_laevat_ult_attack3", "at": 4 },
    { "operator": "chr_0016_laevat", "skill": "chr_0016_laevat_ult_attack4", "at": 4.366666666666666 },
    { "operator": "chr_0016_laevat", "skill": "chr_0016_laevat_ult_attack1", "at": 5.266666666666667 },
    { "operator": "chr_0036_jsspsi", "skill": "chr_0036_jsspsi_normal_skill", "at": 5.266666666666667 },
    { "operator": "chr_0016_laevat", "skill": "chr_0016_laevat_ult_attack2", "at": 5.7 },
    { "operator": "chr_0016_laevat", "skill": "chr_0016_laevat_ult_attack3", "at": 6.4 },
    { "operator": "chr_0036_jsspsi", "skill": "chr_0036_jsspsi_normal_skill_1", "at": 6.4 },
    { "operator": "chr_0016_laevat", "skill": "chr_0016_laevat_ult_attack4", "at": 6.766666666666667 },
    { "operator": "chr_0016_laevat", "skill": "chr_0016_laevat_ult_attack1", "at": 7.666666666666667 },
    { "operator": "chr_0016_laevat", "skill": "chr_0016_laevat_ult_attack2", "at": 8.1 },
    { "operator": "chr_0036_jsspsi", "skill": "chr_0036_jsspsi_normal_skill_2", "at": 8.1 },
    { "operator": "chr_0016_laevat", "skill": "chr_0016_laevat_ult_attack3", "at": 8.8 },
    { "operator": "chr_0016_laevat", "skill": "chr_0016_laevat_ult_attack4", "at": 9.166666666666666 },
    { "operator": "chr_0016_laevat", "skill": "chr_0016_laevat_ult_attack1", "at": 10.066666666666666 },
    { "operator": "chr_0016_laevat", "skill": "chr_0016_laevat_ult_attack2", "at": 10.5 },
    { "operator": "chr_0016_laevat", "skill": "chr_0016_laevat_ult_attack3", "at": 11.2 },
    { "operator": "chr_0016_laevat", "skill": "chr_0016_laevat_ult_attack4", "at": 11.566666666666666 },
    { "operator": "chr_0016_laevat", "skill": "chr_0016_laevat_ult_attack1", "at": 12.466666666666667 },
    { "operator": "chr_0036_jsspsi", "skill": "chr_0036_jsspsi_normal_skill", "at": 12.466666666666667 },
    { "operator": "chr_0016_laevat", "skill": "chr_0016_laevat_ult_attack2", "at": 12.9 },
    { "operator": "chr_0016_laevat", "skill": "chr_0016_laevat_ult_attack3", "at": 13.6 },
    { "operator": "chr_0016_laevat", "skill": "chr_0016_laevat_ult_attack4", "at": 14.066666666666666 },
    { "operator": "chr_0035_liino", "skill": "chr_0035_liino_combo_skill", "at": 14.066666666666666 },
    { "operator": "chr_0016_laevat", "skill": "chr_0016_laevat_plunging_attack_end", "at": 16.233333333333334 },
    { "operator": "chr_0035_liino", "skill": "chr_0035_liino_normal_skill_end", "at": 16.233333333333334 },
    { "operator": "chr_0035_liino", "skill": "chr_0035_liino_normal_skill", "at": 16.233333333333334 },
    { "operator": "chr_0036_jsspsi", "skill": "chr_0036_jsspsi_normal_skill_1", "at": 16.233333333333334 },
    { "operator": "chr_0036_jsspsi", "skill": "chr_0036_jsspsi_normal_skill_2", "at": 16.966666666666665 },
    { "operator": "chr_0016_laevat", "skill": "chr_0016_laevat_combo_skill", "at": 17.4 },
    { "operator": "chr_0016_laevat", "skill": "chr_0016_laevat_plunging_attack_end", "at": 18.866666666666667 }
  ]
}
