{
  "$schema": "../schemas/scenario.schema.json",
  "description": "Camille (her build from btl_upload_40d9a3c1da37: P3, Blessing of Lustrous Carmine, three Frontiers pieces) with Gilberta vs Rhodagn, both ultimates charged. Camille's battle skill inflicts Heat and leaves the Vesperwings hovering (Weakness, Heat Susceptibility; her weapon's team Heat DMG on the hit itself); Gilberta's battle skill turns the Heat into Corrosion, which opens Camille's combo: on the hovering target it explodes 0.4 s after its third hit, gives the team a Link stack (talent 1) that Gilberta's ultimate then uses (×1.2), heals Camille (two Bloodfount Revival layers each, a quarter of it for Gilberta) and its natural SP gives the team the weapon's ATK. Camille's ultimate inflicts Heat and arms Hunter Pursuit, which the battle-skill button then casts: a combo-kind skill with no combo window, its own Link, explosion and heal.",
  "team": [
    "camille-p3.json",
    "gilberta-usp02.json"
  ],
  "target": {
    "enemy": "eny_0051_rodin",
    "level": 90
  },
  "startEnergy": {
    "chr_0033_camille": "full",
    "chr_0013_aglina": "full"
  },
  "durationSeconds": 20,
  "crit": "expected",
  "rotation": [
    { "operator": "chr_0033_camille", "skill": "chr_0033_camille_normal_skill" },
    { "operator": "chr_0013_aglina", "skill": "chr_0013_aglina_normal_skill", "at": 1.0 },
    { "operator": "chr_0033_camille", "skill": "chr_0033_camille_combo_skill" },
    { "operator": "chr_0013_aglina", "skill": "chr_0013_aglina_ultimate_skill", "at": 7.0 },
    { "operator": "chr_0033_camille", "skill": "chr_0033_camille_ultimate_skill" },
    { "operator": "chr_0033_camille", "skill": "chr_0033_camille_combo_skill_2" },
    { "operator": "chr_0033_camille", "skill": "chr_0033_camille_attack1" },
    { "operator": "chr_0033_camille", "skill": "chr_0033_camille_attack2" },
    { "operator": "chr_0033_camille", "skill": "chr_0033_camille_attack3" },
    { "operator": "chr_0033_camille", "skill": "chr_0033_camille_attack4" },
    { "operator": "chr_0033_camille", "skill": "chr_0033_camille_attack5" }
  ]
}
