{
  "$schema": "../schemas/scenario.schema.json",
  "description": "Yvonne (P5, Navigator, MI Security) with Fluorite vs Rhodagn, Yvonne's ultimate charged. Fluorite's battle skill leaves Nature Infliction; Yvonne's bomb consumes it, forces Solidification at the consumed level and deals atk_scale + atk_scale2 + atk_scale_layer per stack (energy usp_base + usp_layer per stack; Navigator's doubled buff acts on the bomb). Talent 1 makes her next basic attack the Final Strike (attack5, DMG +50%), which on the Solidified enemy opens her combo (P1: six ticks 0.5 s apart, then an explosion that Solidifies again). A plain chain ends in attack5 after attack4. The ultimate's state (7 s from frame 61) turns basic attacks into the enhanced chain, whose shots build up to 10 layers (Crit Rate +3% each, Crit DMG +6% each at 10); in the end state the input is the enhanced Final Strike, with its extra shot on a Solidified enemy.",
  "team": ["yvonne-p5.json", "fluorite-p5.json"],
  "target": { "enemy": "eny_0051_rodin", "level": 90 },
  "startEnergy": { "chr_0017_yvonne": "full" },
  "durationSeconds": 40,
  "crit": "expected",
  "rotation": [
    { "operator": "chr_0022_bounda", "skill": "chr_0022_bounda_normal_skill" },
    { "operator": "chr_0017_yvonne", "skill": "chr_0017_yvonne_normal_skill", "at": 3.5 },
    { "operator": "chr_0017_yvonne", "skill": "chr_0017_yvonne_attack5", "at": 4.7 },
    { "operator": "chr_0017_yvonne", "skill": "chr_0017_yvonne_combo_skill" },
    { "operator": "chr_0017_yvonne", "skill": "chr_0017_yvonne_attack1" },
    { "operator": "chr_0017_yvonne", "skill": "chr_0017_yvonne_attack2" },
    { "operator": "chr_0017_yvonne", "skill": "chr_0017_yvonne_attack3" },
    { "operator": "chr_0017_yvonne", "skill": "chr_0017_yvonne_attack4" },
    { "operator": "chr_0017_yvonne", "skill": "chr_0017_yvonne_attack5" },
    { "operator": "chr_0017_yvonne", "skill": "chr_0017_yvonne_ultimate_skill" },
    { "operator": "chr_0017_yvonne", "skill": "chr_0017_yvonne_ult_attack1_1" },
    { "operator": "chr_0017_yvonne", "skill": "chr_0017_yvonne_ult_attack2_1" },
    { "operator": "chr_0017_yvonne", "skill": "chr_0017_yvonne_ult_attack2_2" },
    { "operator": "chr_0017_yvonne", "skill": "chr_0017_yvonne_ult_attack3_1" },
    { "operator": "chr_0017_yvonne", "skill": "chr_0017_yvonne_ult_attack3_2" },
    { "operator": "chr_0017_yvonne", "skill": "chr_0017_yvonne_ult_attack3_2" },
    { "operator": "chr_0017_yvonne", "skill": "chr_0017_yvonne_ult_attack3_2" },
    { "operator": "chr_0017_yvonne", "skill": "chr_0017_yvonne_ult_attack3_2" },
    { "operator": "chr_0017_yvonne", "skill": "chr_0017_yvonne_ult_attack3_2" },
    { "operator": "chr_0017_yvonne", "skill": "chr_0017_yvonne_ult_attack3_2" },
    { "operator": "chr_0017_yvonne", "skill": "chr_0017_yvonne_ult_attack3_2" },
    { "operator": "chr_0017_yvonne", "skill": "chr_0017_yvonne_ult_attack3_2" },
    { "operator": "chr_0017_yvonne", "skill": "chr_0017_yvonne_ult_attack_end", "at": 18.4 }
  ]
}
