{
  "$schema": "../schemas/scenario.schema.json",
  "description": "Catcher alone (P5, Quencher, Æthertech ×4) vs Rhodagn, which attacks at 1, 12 and 23 s (its clock: time stops and slow-downs delay them) and charges a skill at 7 s; she starts with her ultimate charged. Battle skills the attack catches (frames 0–45) counter: the playhead jumps to 60, the bash lands at 83 (1 Vulnerable, P1 strike, Æthertech layer) and the action ends at 194; the one cast at 2.17 s in the counter's recast window (95–129) isn't attacked, so it jumps 45 → 255 and holds her 2.5 s. The charge opens the combo window (shield: P5 SP on the next bash, which also uses the combo's Link). The ultimate adds Weakness, a Knock Down and three shockwaves (talent 2 at level 2), each hit with a P1 strike; the last bash brings the enemy to 4 Vulnerable (Æthertech's extra bonus). Interim: the ultimate after the second counter has an explicit time, since a rotation step judged before an attack doesn't see the counter path's end (docs/kit-batches/batch-2/chr_0020_meurs.md, § Kit, gap K2).",
  "team": [
    "catcher-p5.json"
  ],
  "target": {
    "enemy": "eny_0051_rodin",
    "level": 90
  },
  "startEnergy": {
    "chr_0020_meurs": "full"
  },
  "durationSeconds": 30,
  "crit": "expected",
  "enemyActions": [
    { "kind": "attack", "at": [1, 12, 23] },
    { "kind": "charge", "at": [7] }
  ],
  "rotation": [
    { "operator": "chr_0020_meurs", "skill": "chr_0020_meurs_normal_skill" },
    { "operator": "chr_0020_meurs", "skill": "chr_0020_meurs_normal_skill" },
    { "operator": "chr_0020_meurs", "skill": "chr_0020_meurs_attack1" },
    { "operator": "chr_0020_meurs", "skill": "chr_0020_meurs_attack2" },
    { "operator": "chr_0020_meurs", "skill": "chr_0020_meurs_attack3" },
    { "operator": "chr_0020_meurs", "skill": "chr_0020_meurs_attack4" },
    { "operator": "chr_0020_meurs", "skill": "chr_0020_meurs_combo_skill" },
    { "operator": "chr_0020_meurs", "skill": "chr_0020_meurs_normal_skill", "at": 11.5 },
    { "operator": "chr_0020_meurs", "skill": "chr_0020_meurs_ultimate_skill", "at": 17 },
    { "operator": "chr_0020_meurs", "skill": "chr_0020_meurs_attack1" },
    { "operator": "chr_0020_meurs", "skill": "chr_0020_meurs_attack2" },
    { "operator": "chr_0020_meurs", "skill": "chr_0020_meurs_attack3" },
    { "operator": "chr_0020_meurs", "skill": "chr_0020_meurs_attack4" },
    { "operator": "chr_0020_meurs", "skill": "chr_0020_meurs_normal_skill" }
  ]
}
