{
  "$schema": "../schemas/scenario.schema.json",
  "description": "Si (Team Position 01, so her battle skill inflicts Cryo) with Laevatain vs Rhodagn, both ultimates charged. Si's ultimate gives the team Cryo and Heat Amp; her battle skill inflicts Cryo, Laevatain's enhanced sequence 3 adds Heat, and the Combustion that consumes the Cryo opens both combo windows (Si's: Cryo consumed; Laevatain's: Combustion). Si's build is the one in fixtures/zmdlogs-40d9a3c1da37.json with all attribute nodes; Jade Vessel's and the Type 50 Yinglung set's effects come from their kits.",
  "team": [
    "si-jade-vessel.json",
    "laevatain-forgeborn.json"
  ],
  "target": {
    "enemy": "eny_0051_rodin",
    "level": 90
  },
  "startEnergy": {
    "chr_0036_jsspsi": "full",
    "chr_0016_laevat": "full"
  },
  "durationSeconds": 20,
  "crit": "expected",
  "rotation": [
    { "operator": "chr_0036_jsspsi", "skill": "chr_0036_jsspsi_ultimate_skill" },
    { "operator": "chr_0036_jsspsi", "skill": "chr_0036_jsspsi_normal_skill" },
    { "operator": "chr_0016_laevat", "skill": "chr_0016_laevat_ultimate_skill" },
    { "operator": "chr_0016_laevat", "skill": "swap" },
    { "operator": "chr_0016_laevat", "skill": "chr_0016_laevat_ult_attack1" },
    { "operator": "chr_0016_laevat", "skill": "chr_0016_laevat_ult_attack2" },
    { "operator": "chr_0016_laevat", "skill": "chr_0016_laevat_ult_attack3" },
    { "operator": "chr_0036_jsspsi", "skill": "chr_0036_jsspsi_combo_skill" },
    { "operator": "chr_0016_laevat", "skill": "chr_0016_laevat_combo_skill" },
    { "operator": "chr_0016_laevat", "skill": "chr_0016_laevat_ult_attack4" },
    { "operator": "chr_0016_laevat", "skill": "chr_0016_laevat_normal_skill_during_ult" },
    { "operator": "chr_0016_laevat", "skill": "chr_0016_laevat_ult_attack1" },
    { "operator": "chr_0016_laevat", "skill": "chr_0016_laevat_ult_attack2" },
    { "operator": "chr_0016_laevat", "skill": "chr_0016_laevat_ult_attack3" },
    { "operator": "chr_0016_laevat", "skill": "chr_0016_laevat_ult_attack4" }
  ]
}
