{
  "$schema": "../schemas/scenario.schema.json",
  "description": "Typhoeus (P5, the build of fixtures/zmdlogs-bdf223db8e49.json) with Gilberta (the build of fixtures/zmdlogs-d9e59d0fb737.json) applying Nature Infliction, vs Rhodagn. Typhoeus starts with 4 Signs and 4 Hunting Arrows (talent 1, dungeon fight start) and her ultimate charged: it adds 3 arrows (P5, capped at 4) and the Hovering state, so aerial shots 1–4 are Power Shots (shot 2 consumes Gilberta's infliction for the stronger burst), each with a Hail of Arrows, and shot 5 always is one. Bursts and consumptions give Signs; the battle-skill hovers have no arrows left (shots 1–4 plain, the 5th a Power Shot). The floating combo is cast at the 5th shot of the third hover (it keeps the hover), converting 8 Signs to 4 arrows for a full Power-Shot hover. Shot 2 waits until frame 63 of shot 1: the timeline's chain gate (engine change pending; see docs/kit-batches/batch-1/chr_0034_typhoea.md, Kit).",

  "team": [
    "typhoeus-p5.json",
    {
      "operator": "chr_0013_aglina",
      "level": 90,
      "promotion": 4,
      "potential": 1,
      "skillLevels": { "basic": 9, "battle": 9, "combo": 9, "ultimate": 12 },
      "weapon": { "id": "wpn_funnel_0011", "level": 90, "skillLevels": [9, 9, 4] },
      "gear": [
        { "id": "item_equip_t4_suit_phy01_hand_03", "artifice": [3, 3, 3] },
        { "id": "item_equip_t4_suit_phy01_body_02", "artifice": [3, 3, 3] },
        { "id": "item_equip_t4_suit_phy01_edc_01", "artifice": [3, 3, 0] },
        { "id": "item_equip_t4_suit_heal01_edc_03", "artifice": [3, 3, 3] }
      ]
    }
  ],
  "target": { "enemy": "eny_0051_rodin", "level": 90 },
  "startEnergy": { "chr_0034_typhoea": "full" },
  "durationSeconds": 60,
  "crit": "expected",
  "rotation": [
    { "operator": "chr_0013_aglina", "skill": "chr_0013_aglina_normal_skill" },
    { "operator": "chr_0034_typhoea", "skill": "chr_0034_typhoea_ultimate_skillfloating", "at": 2.5 },
    { "operator": "chr_0034_typhoea", "skill": "chr_0034_typhoea_floating_attack1" },
    { "operator": "chr_0034_typhoea", "skill": "chr_0034_typhoea_floating_attack2" },
    { "operator": "chr_0034_typhoea", "skill": "chr_0034_typhoea_floating_attack3" },
    { "operator": "chr_0034_typhoea", "skill": "chr_0034_typhoea_floating_attack4" },
    { "operator": "chr_0034_typhoea", "skill": "chr_0034_typhoea_floating_attack5" },
    { "operator": "chr_0013_aglina", "skill": "chr_0013_aglina_normal_skill" },
    { "operator": "chr_0034_typhoea", "skill": "chr_0034_typhoea_normal_skill_floating_start", "at": 12 },
    { "operator": "chr_0034_typhoea", "skill": "chr_0034_typhoea_floating_attack1" },
    { "operator": "chr_0034_typhoea", "skill": "chr_0034_typhoea_floating_attack2" },
    { "operator": "chr_0034_typhoea", "skill": "chr_0034_typhoea_floating_attack3" },
    { "operator": "chr_0034_typhoea", "skill": "chr_0034_typhoea_floating_attack4" },
    { "operator": "chr_0034_typhoea", "skill": "chr_0034_typhoea_floating_attack5" },
    { "operator": "chr_0013_aglina", "skill": "chr_0013_aglina_normal_skill" },
    { "operator": "chr_0034_typhoea", "skill": "chr_0034_typhoea_normal_skill_floating_start", "at": 28 },
    { "operator": "chr_0034_typhoea", "skill": "chr_0034_typhoea_floating_attack1" },
    { "operator": "chr_0034_typhoea", "skill": "chr_0034_typhoea_floating_attack2" },
    { "operator": "chr_0034_typhoea", "skill": "chr_0034_typhoea_floating_attack3" },
    { "operator": "chr_0034_typhoea", "skill": "chr_0034_typhoea_floating_attack4" },
    { "operator": "chr_0034_typhoea", "skill": "chr_0034_typhoea_floating_attack5" },
    { "operator": "chr_0034_typhoea", "skill": "chr_0034_typhoea_combo_skillfloating" },
    { "operator": "chr_0034_typhoea", "skill": "chr_0034_typhoea_floating_attack1" },
    { "operator": "chr_0034_typhoea", "skill": "chr_0034_typhoea_floating_attack2" },
    { "operator": "chr_0034_typhoea", "skill": "chr_0034_typhoea_floating_attack3" },
    { "operator": "chr_0034_typhoea", "skill": "chr_0034_typhoea_floating_attack4" },
    { "operator": "chr_0034_typhoea", "skill": "chr_0034_typhoea_floating_attack5" }
  ]
}
